{
  "$schema": "schemas/production-manifest.schema.json",
  "schema_version": "1.0.0",
  "project_id": "sstory-map-production",
  "map_id": "eternal-arcadia",
  "coordinate_system": "EA-WORLD-1",
  "epoch": "2026-07-18",
  "style_guide_path": "world/map-production/spec/style-bible.md",
  "updated_at": "2026-07-19T16:36:13Z",
  "jobs": [
    {
      "id": "style-candidate-a-v1",
      "sheet_id": "style-candidate-a",
      "status": "rejected",
      "bounds": {
        "west": 0,
        "south": 0,
        "east": 10000,
        "north": 10000
      },
      "zoom": {
        "min": 0,
        "max": 2,
        "native": 2
      },
      "acceptance_threshold": 94,
      "inputs": [
        {
          "path": "world/map-production/prompts/style-candidate-v1.md",
          "sha256": "e11b38f259dfe36d8d3fa72438ed474891dee012d3cf931043a2f7feac45d9db",
          "role": "shared-style-prompt"
        }
      ],
      "generation": {
        "model": "OpenAI ImageGen (Codex built-in)",
        "prompt_path": "world/map-production/prompts/style-candidate-v1.md",
        "prompt_sha256": "e11b38f259dfe36d8d3fa72438ed474891dee012d3cf931043a2f7feac45d9db",
        "attempt": 1
      },
      "master": {
        "path": "world/map-production/candidates/style-candidate-a-v1.png",
        "sha256": "ab4af104987ebabfb3196cebcd49ddd4f935f5b169949dec89c7729b03a3700c",
        "width": 1536,
        "height": 1024,
        "color_profile": "sRGB"
      },
      "qa": {
        "automated": {
          "status": "passed",
          "report_path": "world/map-production/qa/style-candidate-a-v1.json"
        },
        "vision": {
          "decision": "rejected",
          "score": 84,
          "report_path": "world/map-production/qa/style-candidate-a-v1-review2.json",
          "reviewer": "Independent Codex Vision QA",
          "reviewed_at": "2026-07-18T15:25:00Z"
        }
      },
      "history": [
        {
          "state": "planned",
          "at": "2026-07-18T09:54:00Z",
          "actor": "Codex",
          "note": "Established the three-candidate comparison plan."
        },
        {
          "state": "inputs-ready",
          "at": "2026-07-18T09:56:00Z",
          "actor": "Codex",
          "note": "Locked the shared style prompt and existing world-map reference."
        },
        {
          "state": "generated",
          "at": "2026-07-18T10:08:33Z",
          "actor": "OpenAI ImageGen"
        },
        {
          "state": "automated-qa",
          "at": "2026-07-18T10:09:00Z",
          "actor": "Codex",
          "note": "Verified PNG readability, dimensions, and SHA-256."
        },
        {
          "state": "vision-qa",
          "at": "2026-07-18T10:12:00Z",
          "actor": "Codex Vision QA"
        },
        {
          "state": "revise",
          "at": "2026-07-18T10:13:00Z",
          "actor": "Codex",
          "note": "Strong candidate, but below the 94-point golden threshold pending B/C comparison."
        },
        {
          "state": "rejected",
          "at": "2026-07-18T15:25:00Z",
          "actor": "Independent Codex Vision QA",
          "note": "Second review found a perspective immediate failure and ranked B as the stronger revision base."
        }
      ],
      "notes": "Style-board candidate only. Automated QA covers file integrity, not a canon geometry overlay."
    },
    {
      "id": "style-candidate-b-v1",
      "sheet_id": "style-candidate-b",
      "status": "revise",
      "bounds": {
        "west": 0,
        "south": 0,
        "east": 10000,
        "north": 10000
      },
      "zoom": {
        "min": 0,
        "max": 2,
        "native": 2
      },
      "acceptance_threshold": 94,
      "inputs": [
        {
          "path": "world/map-production/prompts/style-candidate-b-v1.md",
          "sha256": "a9cb6349a996d9a9e078b2c4370b3d0436a0c395c6a4cad2b913be8f2de5713c",
          "role": "candidate-specific-prompt"
        }
      ],
      "generation": {
        "model": "OpenAI ImageGen (Codex built-in)",
        "prompt_path": "world/map-production/prompts/style-candidate-b-v1.md",
        "prompt_sha256": "a9cb6349a996d9a9e078b2c4370b3d0436a0c395c6a4cad2b913be8f2de5713c",
        "attempt": 1
      },
      "master": {
        "path": "world/map-production/candidates/style-candidate-b-v1.png",
        "sha256": "4d505def78acc752ee2611cb73d112cc9a3048f611cb05233274a1eb2ae42003",
        "width": 1536,
        "height": 1024,
        "color_profile": "sRGB"
      },
      "qa": {
        "automated": {
          "status": "passed",
          "report_path": "world/map-production/qa/style-candidate-b-v1.json"
        },
        "vision": {
          "decision": "revise",
          "score": 89,
          "report_path": "world/map-production/qa/style-candidate-b-v1-review2.json",
          "reviewer": "Independent Codex Vision QA",
          "reviewed_at": "2026-07-18T15:25:00Z"
        }
      },
      "history": [
        {
          "state": "planned",
          "at": "2026-07-18T11:58:00Z",
          "actor": "Codex",
          "note": "Candidate B keeps the common style specification and changes readability only."
        },
        {
          "state": "inputs-ready",
          "at": "2026-07-18T11:59:00Z",
          "actor": "Codex",
          "note": "Locked the high-readability prompt and legacy world-map style reference."
        },
        {
          "state": "generated",
          "at": "2026-07-18T12:01:48Z",
          "actor": "OpenAI ImageGen"
        },
        {
          "state": "automated-qa",
          "at": "2026-07-18T12:04:00Z",
          "actor": "Codex",
          "note": "Verified PNG readability, dimensions, and SHA-256."
        },
        {
          "state": "vision-qa",
          "at": "2026-07-18T12:08:00Z",
          "actor": "Codex Vision QA",
          "note": "First review reached 94; final golden acceptance waits for candidate C and an independent second review."
        },
        {
          "state": "revise",
          "at": "2026-07-18T15:25:00Z",
          "actor": "Independent Codex Vision QA",
          "note": "Second review found visible mountain and floating-island side faces; retain B and change only the plan-view geometry lock."
        }
      ],
      "notes": "Style-board candidate only. Automated QA covers file integrity, not a canon geometry overlay."
    },
    {
      "id": "style-candidate-c-v1",
      "sheet_id": "style-candidate-c",
      "status": "rejected",
      "bounds": {"west": 0, "south": 0, "east": 10000, "north": 10000},
      "zoom": {"min": 0, "max": 2, "native": 2},
      "acceptance_threshold": 94,
      "inputs": [
        {
          "path": "world/map-production/prompts/style-candidate-c-v1.md",
          "sha256": "ce131abc087e4c967fdfcca1eb3a860433d6c5410c3d732bc97822d9f8307716",
          "role": "candidate-specific-prompt"
        }
      ],
      "generation": {
        "model": "OpenAI ImageGen (Codex built-in)",
        "prompt_path": "world/map-production/prompts/style-candidate-c-v1.md",
        "prompt_sha256": "ce131abc087e4c967fdfcca1eb3a860433d6c5410c3d732bc97822d9f8307716",
        "attempt": 1
      },
      "master": {
        "path": "world/map-production/candidates/style-candidate-c-v1.png",
        "sha256": "07a81bc62ae2f57884917c7d45e886011bf1f3f7ea815ebe66d77fb19050c032",
        "width": 1536,
        "height": 1024,
        "color_profile": "sRGB"
      },
      "qa": {
        "automated": {
          "status": "passed",
          "report_path": "world/map-production/qa/style-candidate-c-v1-review2.json"
        },
        "vision": {
          "decision": "rejected",
          "score": 85,
          "report_path": "world/map-production/qa/style-candidate-c-v1-review2.json",
          "reviewer": "Independent Codex Vision QA",
          "reviewed_at": "2026-07-18T15:25:00Z"
        }
      },
      "history": [
        {"state": "planned", "at": "2026-07-18T15:14:00Z", "actor": "Codex", "note": "Candidate C changes only fine copperplate detail density."},
        {"state": "inputs-ready", "at": "2026-07-18T15:15:00Z", "actor": "Codex", "note": "Locked the candidate C prompt and legacy world-map style reference."},
        {"state": "generated", "at": "2026-07-18T15:18:22Z", "actor": "OpenAI ImageGen"},
        {"state": "automated-qa", "at": "2026-07-18T15:20:00Z", "actor": "Codex", "note": "Verified PNG readability, dimensions, and SHA-256."},
        {"state": "vision-qa", "at": "2026-07-18T15:24:00Z", "actor": "Codex Vision QA"},
        {"state": "rejected", "at": "2026-07-18T15:25:00Z", "actor": "Independent Codex Vision QA", "note": "Perspective failure and overlay density make B the better revision base."}
      ],
      "notes": "Highest engraving density, but weaker vector readability and stronger oblique terrain than candidate B."
    },
    {
      "id": "style-candidate-b-v2-plan-view",
      "sheet_id": "style-candidate-b",
      "status": "revise",
      "bounds": {"west": 0, "south": 0, "east": 10000, "north": 10000},
      "zoom": {"min": 0, "max": 2, "native": 2},
      "acceptance_threshold": 94,
      "inputs": [
        {
          "path": "world/map-production/prompts/style-candidate-b-v2-plan-view.md",
          "sha256": "e106257410becd71e9f247fcbf9400d106358588ce6d90657d8d7cfaf168f5bb",
          "role": "single-change-edit-prompt"
        },
        {
          "path": "world/map-production/candidates/style-candidate-b-v1.png",
          "sha256": "4d505def78acc752ee2611cb73d112cc9a3048f611cb05233274a1eb2ae42003",
          "role": "edit-source"
        }
      ],
      "generation": {
        "model": "OpenAI ImageGen (Codex built-in)",
        "prompt_path": "world/map-production/prompts/style-candidate-b-v2-plan-view.md",
        "prompt_sha256": "e106257410becd71e9f247fcbf9400d106358588ce6d90657d8d7cfaf168f5bb",
        "attempt": 2
      },
      "master": {